<?xml version="1.0" encoding="UTF-8"?>
<tns:patient xmlns:tns="http://www.formation.org/patient2" xmlns:xsi="http://www.w3.org/2001/XMLSchema-instance" xsi:schemaLocation="http://www.formation.org/patient2 patient2.xsd ">
  <id>0</id>
  <name>name</name>
  <age>30</age>
  <DOB>2001-01-01</DOB>
  <email>email</email>
  <gender>gender</gender>
  <phone>phone</phone>
</tns:patient>
